urls,timestamp,record_id,Titles,Host_name,Property_types,Prices_per_night,Check_ins,Check_outs,Cleaning_fees,Location,Ratings,Num_reviews,Viajeros,Dormitorios,Camas,Baños,Maximum_guests,Otros
https://www.airbnb.es/rooms/1239920055875442315?adults=1&category_tag=Tag%3A8678&children=0&enable_m3_private_room=true&infants=0&pets=0&photo_id=2016940308&search_mode=regular_search&check_in=2024-11-25&check_out=2024-11-30&source_impression_id=p3_1730223960_P3Idda_zVV0gVaZN&previous_page_section_name=1000&federated_search_id=3cd7215a-e721-4878-b3f0-173adeec78c2,2024-10-29 21:15:36,1239920055875442315,"Estamos alquilando una PEQUEÑA HABITACIÓN PRIVADA en Poble Sec, a poca distancia a pie de: Plaza España, Le Eixample, Plaza Cataluña, Avenida Paralelo, estación de metro, autobús y todo el transporte público.El espacioEstamos alquilando una PEQUEÑA HABITACIÓN PRIVADA (las llaves de la cerradura de la puerta de tu propia habitación para ti. Hay: toallas de uso gratuito, ropa de cama y conexión wifi gratuita). Compartiendo el apartamento y las áreas comunes; cocina, baño y tenemos una señora de la limpieza todos los días para las áreas comunes. -   El apartamento se comparte con huéspedes de Airbnb como tú.Servicios y zonas comunesCocina y bañoOtros aspectos destacablesLa entrada es después de las 15:00hrs. NO hay check-in después de las 24 horas/00 horas      - Tarifa extra de 20 euros por llegada después de las 20 horas.    La salida se realizará antes de las 11:00 a. m.                                                                                                                                                                                                                                                                                                                                                                                                                                                                                                                                                                                                                                                                    – salida después de la hora establecida sin permiso/sin aurthorized... recargo de 30 horas por cada hora  después de las 11: 00 horas.  --  Necesitamos ver  el nombre y el número de identificación o pasaporte de la persona que realiza el check-in.            -- para la limpieza, el saneamiento, la higina y los gustos personales: sin aceite para cocinar, sin sal, sin pimienta(no proporciono estos artículos) -- los huéspedes NO registrados deben ser aprobación previa....30 € cargo diario adicional por cada huésped NO registrado EN LA reserva ..TODAS LAS PERSONAS EN EL APARTAMENTO; DEBEN estar EN LA RESERVA.                                                                                                                                                                                                                                                                                                                                                                                                                                                                                                                                                                                                                                                                                                                                                                                                                                                                                                                                                                                                                                            - NO se admiten bicicletas, scooters -3 planta sin ascensor(sin ascensor)- todos los huéspedes deben ser mayores de 18 años.Tarifa de 60 euros con cargo adicional diario por cualquier mascota acompañante en el apartamento.                                                                                                                                                                                                                                                                                                                                                                                                                                                                                                                                                                                                                                                                                                                                                                                                                                                                                                                                                                                                                                                                                                                                                                                                                                                                                                                                                                                                                                                                                                                                                                                                                                                                                                                                                                                                                                                                                                                                                                                                                                                                                                                                                                                                                                                                                                                                                                                                                                                                                                                                                                                                                                                                                                                                                                                                                                                                                                                                                                                                                                                                                                                                                                                                                                                                                                                                                                                                                                                                                                                                                                                                                                                                                                                                                                                                                                                                                                                                                                                                                                                                                                                                                                                                                                                                                                                                                                                                                                                                                                                                                                                                                                                                                                                                                                                                                                                                                                                                                                                                                                                                                                                                                                                                                                                                                                                                                                                                                                                                                                                                                                                                                                                                                                                                                                                                                                                                                                                                                                                                                                                                                                                                                                                                                                                                                                                                                                                                                                                                                                                                                                                                                                                                                                                                                                                                                                                                                                                                                                                                                                                                                                                                                                                                                                                                                                                                                                                                                                                                                                                                                                                                                                                                                                                                                                                                                                                                                                                                                                                                                                                                                                                                                                                                                                                                                                                                                                                                                                                                                                                                                                                                                                                                                                                                                                                                                                                                                                                                                                                                                                                                                                                                                                                                                                                                                                                                                                                                                                                                                                                                                                                                                                                        -- Esperamos que nos ayudes a limpiar lo que ensucies. Esto incluye limpiar y guardar los platos y utensilios de cocina.  -Todos los daños a la propiedad deben ser reportados a nosotros...    --Nos se cobrarán 20 € por las sábanas o toallas manchadas. Las toallas son para uso solo dentro del apartamento.                                                                                                                                                                                                                                                                   -- Recoger lo que ensucies en zonas comunes es importante. -- tiempo de silencio después de las 22:00h o 22:00h, (NO música ni ruidos fuertes)...hacer fiestas durante este tiempo...la reserva la cancelará y tendrás que salir de la habitación o apartamento sin ningún reembolso. -- En caso de perder las llaves ... hay que pagar 70 €                                                     -- No se pueden usar fiestas, drogas ni alcohol dentro de las habitaciones ni del apartamento. - está prohibido fumar dentro de la habitación o apartamento..(debes tener que pagar 70 €.. limpieza especial) --El apartamento y las habitaciones están en buen estado...(luces, todos los muebles, electrodomésticos, cerraduras y llaves de las puertas) y cumplen con todos los requisitos de orden y limpieza para una convivencia detallada en los anuncios y especificaciones de la normativa de Airbnb. --Para garantizar la plena seguridad de las pertenencias de nuestros huéspedes, nos gusta mantener las puertas del apartamento cerradas como medida de precaución. Siendo Barcelona una de las zonas más seguras de España, queremos asegurarnos de que la estancia de cada huésped esté libre de problemas, y esto es solo una cosa pequeña y sencilla que podemos hacer para garantizarlo. CONFIRMANDO LA RESERVA ACEPTAS TODAS LAS REGLAS DE LA CASA (incumplir las reglas, la reserva se cancelará y tienes que salir de la habitación o apartamento sin ningún reembolso)......GRACIASNúmero de registroHUTB-102371",Quédate con Jesus Maximiliano,"Habitación en Barcelona, España",63 €,Horario de llegada: de 15:00 a 20:00,Salida antes de las 10:00,,"Barcelona, Catalunya, España",Nuevo,,,,1 cama de matrimonio,Baño compartido,2,
https://www.airbnb.es/rooms/545602057442226577?adults=1&category_tag=Tag%3A8678&children=0&enable_m3_private_room=true&infants=0&pets=0&photo_id=1559365984&search_mode=regular_search&check_in=2024-12-07&check_out=2024-12-12&source_impression_id=p3_1730223960_P38PJ9tJJ7dI4oEl&previous_page_section_name=1000&federated_search_id=3cd7215a-e721-4878-b3f0-173adeec78c2,2024-10-29 21:15:36,545602057442226577,"Acogedora habitación privada en el centro de Barcelona, barrio del Poble Sec a tres minutos a pié de la estación de metro Paral.el,Funicular de Montjuic y red de autobuses urbanos .Perfecta ubicación para ir hacia cualquier zona de Barcelona Zona de ocio con teatros,salas de fiesta,bingos,bares y restaurantes donde poder degustar tapas y platillos y disfrutar de un merecido relax.El espacioLa habitación se encuentra en un alojamiento privado Se trata de una estancia Acogedora con cerradura que se compone de una cama individual, armario para guardar la ropa, mesita de noche,mesa escritorio con todos los detalles para poder trabajar,estación de carga con entradas usb y enchufes,silla ergonómica y tv.Servicios y zonas comunesHabitación BañoLavaboDurante tu estanciaLos huéspedes se pueden poner en contacto conmigo a través de llamada,correo electrónico y smsOtros aspectos destacablesLa ubicación en la que se encuentra la vivienda nos permite poder visitar tanto la Ramblas,como el Puerto de Barcelona,el CC Maremágnum,La Fira de Plaza d'España y la montaña de Montjuic a tan sólo 10 minutos a pié. Cómo también se puede visitar la playa de la Barceloneta, el Barrio Gótico, Plaza de Catalunya... entre otros muchos lugares más.Número de registroExempt",Quédate con Magdalena,"Habitación en Barcelona, España",50 €,Horario de llegada: de 15:00 a 0:00,Salida antes de las 12:00,43 €,"Barcelona, Catalunya, España","4,91",,,,1 cama,Baño compartido,1,
https://www.airbnb.es/rooms/1218645303173234166?adults=1&category_tag=Tag%3A8678&children=0&enable_m3_private_room=true&infants=0&pets=0&photo_id=1971156620&search_mode=regular_search&check_in=2025-01-07&check_out=2025-01-12&source_impression_id=p3_1730223969_P3cCZuKKQgnLm32_&previous_page_section_name=1000&federated_search_id=fd8ae661-63da-416e-92bf-d6a2ad4170c6,2024-10-29 21:15:36,1218645303173234166,Disfruta de una habitación individual cerca a la sagrada familia (5 minutos caminando).En el alojamiento donde está la habitación es un espacio tranquilo e ideal para descansar.Número de registroExempt,Anfitrión: Gia,"Habitación en Barcelona, España",40 €,Llegada a partir de las 13:00,Salida antes de las 11:00,34 €,"Barcelona, Catalunya, España","4,93",,,,1 cama individual,Baño compartido,1,
https://www.airbnb.es/rooms/1197637831227097242?adults=1&children=0&enable_m3_private_room=true&infants=0&pets=0&search_mode=regular_search&check_in=2024-11-24&check_out=2024-11-29&source_impression_id=p3_1730223969_P3oUcqPxlrhaOiiO&previous_page_section_name=1000&federated_search_id=fd8ae661-63da-416e-92bf-d6a2ad4170c6,2024-10-29 21:15:36,1197637831227097242,El espacioEl apartamento está así formado:⭑Servicios y zonas comunesLos huéspedes tendrán el entero apartamento a su completa disposición.Otros aspectos destacables✓ Aire acondicionado✓ Internet✓ Check-in/check-out autónomos✓ Sábanas y toallas ✓ 1 minuto de la Rambla✓ 7 minutos de la Catedral✓ 10 minutos de Plaça Catalunya y Passeig de Gràcia✓ 15 minutos de Playa de la BarcelonetaNúmero de registroHUTB-001628,Anfitrión: Raffaele,"Alojamiento entero: apartamento en Barcelona, España",,Llegada a partir de las 15:00,Salida antes de las 11:00,,"Barcelona, Catalunya, España","5,0",3,2 viajeros,1 dormitorio,1 cama,1 baño,2,
https://www.airbnb.es/rooms/41616877?adults=1&category_tag=Tag%3A8678&children=0&enable_m3_private_room=true&infants=0&pets=0&photo_id=1877804377&search_mode=regular_search&check_in=2024-11-19&check_out=2024-11-24&source_impression_id=p3_1730223969_P3COFy_BHwnJYATQ&previous_page_section_name=1000&federated_search_id=fd8ae661-63da-416e-92bf-d6a2ad4170c6,2024-10-29 21:15:36,41616877,"Es toda una zona privada con una cama doble.También tienes un comedor luminoso y privado, con una gran ventana.Baño privado (fuera de la habitación).Acceso a una cocina completa.Número de registroExempt",Quédate con Jose David,"Habitación en Barcelona, España",40 €,Horario de llegada: de 15:00 a 22:00,Salida antes de las 10:00,15 €,"Barcelona, Catalunya, España","4,67",27,,,1 cama de matrimonio,Baño privado en el alojamiento,2,
https://www.airbnb.es/rooms/1202828460995202150?adults=1&children=0&enable_m3_private_room=true&infants=0&pets=0&search_mode=regular_search&check_in=2024-12-08&check_out=2024-12-13&source_impression_id=p3_1730223969_P3GIWKMe7ycl6gM9&previous_page_section_name=1000&federated_search_id=fd8ae661-63da-416e-92bf-d6a2ad4170c6,2024-10-29 21:15:36,1202828460995202150,"Situado en pleno Barrio Gótico, en el corazón de Barcelona. Al lado del Mercado de Santa Caterina, la Catedral y el Born. A dos calles del Palau de la Música Catalana (una de las principales salas de conciertos del mundo) y muy cercano a Plaza Catalunya, a las zonas comerciales de Barcelona (Ramblas, Paseo de Gracia, Porta Ferrisa, Portal de l’Angel) y a dos pasos de la iglesia de Santa María del Mar. Lic. Prov. según sent. 129/2024 de 16/04/24 exp. Ajuntament 01-IU2019-2373> Piso 3º 1ªEl espacioApartamento exterior 54 m² en edificio rehabilitado en 2010 (completamente nuevo), con ascensor, en c/ Sant Pere Més Baix - Ciutat Vella. Totalmente amueblado: electrodomésticos (lavadora, nevera, horno, microondas, tostadora, hervidor eléctrico, secador de pelo, plancha), enseres cocina, vajilla y cubertería, ropa de hogar (mantas, toallas, sábanas). Consta de: • 1 dormitorio con cama de matrimonio de 150 cm. • 1 dormitorio con cama de matrimonio de 135 cm. • 1 baño con ducha • salón comedor con cocina americana • calefacción  • Ventiladores en las habitaciones. 01-IU2019-2375  - Licencia provisional  1_2019_0519213_1 / 18_9_2019 / Ajuntament de Barcelona de conformidad con la sentencia núm. 129/2024 de 16 de abril dictada por el Juzgado de lo Contencioso-Administrativo núm. 16 de Barcelona y de conformidad con la circular interpretativa de 12 de marzo de 2014 de la Generalitat de Catalunya (piso 3º-1ª)Número de registroHUTB-000000",Anfitrión: Cristian,"Alojamiento entero: apartamento en Barcelona, España",80 €,Llegada a partir de las 15:00,Salida antes de las 11:00,45 €,"Barcelona, Catalunya, España","4,75",4,4 viajeros,2 dormitorios,2 camas,1 baño,4,
https://www.airbnb.es/rooms/1260094358313659968?adults=1&children=0&enable_m3_private_room=true&infants=0&pets=0&search_mode=regular_search&check_in=2024-11-04&check_out=2024-11-09&source_impression_id=p3_1730223969_P3ynUD6-xt3J0Q4U&previous_page_section_name=1000&federated_search_id=fd8ae661-63da-416e-92bf-d6a2ad4170c6,2024-10-29 21:15:36,1260094358313659968,"Me encanta viajar, compartir y conocer lugares y personas. Soy muy trabajadora, tengo 3 hijos y a pesar de ser joven ya tengo 2 nietos.",Anfitrión: Diana Maria,"Alojamiento entero: loft en Barcelona, España",73 €,Horario de llegada: de 15:00 a 22:00,Salida antes de las 11:00,28 €,"Barcelona, Catalunya, España",Nuevo,,3 viajeros,1 dormitorio,2 camas,1 baño,3,
https://www.airbnb.es/rooms/22991302?adults=1&children=0&enable_m3_private_room=true&infants=0&pets=0&search_mode=regular_search&check_in=2024-12-01&check_out=2024-12-06&source_impression_id=p3_1730223969_P3ZXTxpiC_MloNCt&previous_page_section_name=1000&federated_search_id=fd8ae661-63da-416e-92bf-d6a2ad4170c6,2024-10-29 21:15:36,22991302,"Ideal para familias o parejas. Apartamento de un dormitorio con capacidad máxima 4 personas, a minutos de Plaza Cataluña&Born. Ubicación ideal, minutos  de la Sagrada Familia. El apartamento dispone de 1 habitación (cama de matrimonio/o dos camas individuales) + sofá cama doble en salón, cocina y baño. Puedes caminar a los principales lugares turísticos. Museo Picasso, Arco de Triunfo, parque de la Ciutadella. Posibilidad de parking en el edificio y fácil check in con cerradura inteligenteEl espacioApartamento ideal de 1 dormitorio con capacidad para 2-4 personas, en el centro de la ciudad de Barcelona. El estudio tiene una cama doble o 2 individuales mas sofa cama en el comedor, cocina completamente equipado y baño. Está en una zona muy bonita, cerca de Born, puedes caminar a los principales lugares turísticos. El Museo Picasso, Arc de Triomf, el parque de la Ciutadella están muy cerca del apartamento. Camino fácil a la iglesia de La Sagrada Familia o al Port Olímpic (vida nocturna y buenos restaurantes de mariscos).Hay un estacionamiento en el edificio por un precio extra de 20 € / por noche. Dos paradas de metro muy cerca: línea roja L1 Arc de Triomf y línea púrpura L2 Tetuán. Al lado de varias paradas de autobús y la Gran Vía.Número de registroHUTB-001930",Anfitrión: Georgina,"Alojamiento entero: apartamento en Barcelona, España",108 €,Llegada a partir de las 15:00,Salida antes de las 11:00,25 €,"Barcelona, Catalunya, España","4,51",448,4 viajeros,1 dormitorio,3 camas,1 baño,4,
